<?xml version="1.0" encoding="UTF-8"?>
<xs:schema xmlns:xs="http://www.w3.org/2001/XMLSchema" xmlns="http://www.toomanysecrets.com/tipovi"
    targetNamespace="http://www.toomanysecrets.com/tipovi" elementFormDefault="qualified">

    <xs:element name="MT102">
        <xs:complexType>
            <xs:sequence>
                <xs:element name="zaglavljeMT102">
                    <xs:complexType>
                        <xs:sequence>
                            <xs:element name="swiftBankeDuznika">
                                <xs:simpleType>
                                    <xs:restriction base="xs:string">
                                        <xs:minLength value="8"/>
                                        <xs:maxLength value="11"/>
                                        <xs:pattern
                                            value="[A-Z]{4}[A-Z]{2}[0-9A-Z]{2}([0-9A-Z]{3})?"/>
                                    </xs:restriction>
                                </xs:simpleType>
                            </xs:element>
                            <xs:element name="obracunskiRacunBankeDuzinka">
                                <xs:simpleType>
                                    <xs:restriction base="xs:string">
                                        <xs:length value="18"/>
                                        <xs:pattern value="[0-9]{3}[0-9]{13}[0-9]{2}"/>
                                    </xs:restriction>
                                </xs:simpleType>
                            </xs:element>
                            <xs:element name="swiftBankePoverioca">
                                <xs:simpleType>
                                    <xs:restriction base="xs:string">
                                        <xs:minLength value="8"/>
                                        <xs:maxLength value="11"/>
                                        <xs:pattern
                                            value="[A-Z]{4}[A-Z]{2}[0-9A-Z]{2}([0-9A-Z]{3})?"/>
                                    </xs:restriction>
                                </xs:simpleType>
                            </xs:element>
                            <xs:element name="obracunskiRacunBankePoverioca">
                                <xs:simpleType>
                                    <xs:restriction base="xs:string">
                                        <xs:length value="18"/>
                                        <xs:pattern value="[0-9]{3}[0-9]{13}[0-9]{2}"/>
                                    </xs:restriction>
                                </xs:simpleType>
                            </xs:element>
                            <xs:element name="ukupanIznos">
                                <xs:simpleType>
                                    <xs:restriction base="xs:decimal">
                                        <xs:totalDigits value="15"/>
                                        <xs:fractionDigits value="2"/>
                                    </xs:restriction>
                                </xs:simpleType>
                            </xs:element>
                            <xs:element name="sifraValute">
                                <xs:simpleType>
                                    <xs:restriction base="xs:string">
                                        <xs:length value="3"/>
                                    </xs:restriction>
                                </xs:simpleType>
                            </xs:element>
                            <xs:element name="datumValute" type="xs:date"/>
                            <xs:element name="datum" type="xs:date"/>
                        </xs:sequence>
                        <xs:attribute name="idPoruke" use="required">
                            <xs:simpleType>
                                <xs:restriction base="xs:string">
                                    <xs:maxLength value="50"/>
                                </xs:restriction>
                            </xs:simpleType>
                        </xs:attribute>
                    </xs:complexType>
                </xs:element>
                <xs:element maxOccurs="unbounded" name="pojedinacnaUplata">
                    <xs:complexType>
                        <xs:sequence>
                            <xs:element name="duznik">
                                <xs:simpleType>
                                    <xs:restriction base="xs:string">
                                        <xs:maxLength value="255"/>
                                    </xs:restriction>
                                </xs:simpleType>
                            </xs:element>
                            <xs:element name="svrhaUplate">
                                <xs:simpleType>
                                    <xs:restriction base="xs:string">
                                        <xs:maxLength value="255"/>
                                    </xs:restriction>
                                </xs:simpleType>
                            </xs:element>
                            <xs:element name="primalac">
                                <xs:simpleType>
                                    <xs:restriction base="xs:string">
                                        <xs:maxLength value="255"/>
                                    </xs:restriction>
                                </xs:simpleType>
                            </xs:element>
                            <xs:element name="datumNaloga" type="xs:date"/>
                            <xs:element name="racunDuznika">
                                <xs:simpleType>
                                    <xs:restriction base="xs:string">
                                        <xs:length value="18"/>
                                        <xs:pattern value="[0-9]{3}[0-9]{13}[0-9]{2}"/>
                                    </xs:restriction>
                                </xs:simpleType>
                            </xs:element>
                            <xs:element name="modelZaduzenja">
                                <xs:simpleType>
                                    <xs:restriction base="xs:int">
                                        <xs:minInclusive value="0"/>
                                        <xs:totalDigits value="2"/>
                                    </xs:restriction>
                                </xs:simpleType>
                            </xs:element>
                            <xs:element name="pozivNaBrojZaduzenja">
                                <xs:simpleType>
                                    <xs:restriction base="xs:string">
                                        <xs:maxLength value="20"/>
                                    </xs:restriction>
                                </xs:simpleType>
                            </xs:element>
                            <xs:element name="racunPoverioca">
                                <xs:simpleType>
                                    <xs:restriction base="xs:string">
                                        <xs:length value="18"/>
                                        <xs:pattern value="[0-9]{3}[0-9]{13}[0-9]{2}"/>
                                    </xs:restriction>
                                </xs:simpleType>
                            </xs:element>
                            <xs:element name="modelOdobrenja">
                                <xs:simpleType>
                                    <xs:restriction base="xs:int">
                                        <xs:minInclusive value="0"/>
                                        <xs:totalDigits value="2"/>
                                    </xs:restriction>
                                </xs:simpleType>
                            </xs:element>
                            <xs:element name="pozivNaBrojOdobrenja">
                                <xs:simpleType>
                                    <xs:restriction base="xs:string">
                                        <xs:maxLength value="20"/>
                                    </xs:restriction>
                                </xs:simpleType>
                            </xs:element>
                            <xs:element name="iznos">
                                <xs:simpleType>
                                    <xs:restriction base="xs:decimal">
                                        <xs:totalDigits value="15"/>
                                        <xs:fractionDigits value="2"/>
                                    </xs:restriction>
                                </xs:simpleType>
                            </xs:element>
                            <xs:element name="sifraValute">
                                <xs:simpleType>
                                    <xs:restriction base="xs:string">
                                        <xs:length value="3"/>
                                    </xs:restriction>
                                </xs:simpleType>
                            </xs:element>
                        </xs:sequence>
                        <xs:attribute name="idNamogaLzaPlacanje" use="required">
                            <xs:simpleType>
                                <xs:restriction base="xs:string">
                                    <xs:maxLength value="50"/>
                                </xs:restriction>
                            </xs:simpleType>
                        </xs:attribute>
                    </xs:complexType>
                </xs:element>
            </xs:sequence>
        </xs:complexType>
    </xs:element>
</xs:schema>
